{"artifacts":[{"id":"alpha","path":"forms/a.pdf","bytes":32,"sha256":"630dcd2966c4336691125448bbb25b4ff412a49c732db2c8abc1b8581bd710dd"},{"id":"beta","path":"forms/b.pdf","bytes":32,"sha256":"72dbb7336c76780023f83da4c355f2eeea85733b13d3477697917790c1229084"}],"result":{"path":"result.json","bytes":1199,"sha256":"ef20ab2556c11c3d7126be5c418b120a318e77a00cda7c04740f90ef643ed89e"},"toolBuild":"golden-build-1","requestId":"golden-request-1","schema":"pdfform.completion/1"}